title,url,publishedAt
Bangladesh students defy ban to continue protests,https://www.bbc.com/news/articles/cl4ymjrx10xo,2024-07-19T10:30:03Z
Deadly unrest over job quotas grips Bangladesh,https://www.bbc.com/news/articles/cd1rzm4kjx0o,2024-07-17T00:24:22Z
Dozens wounded as Bangladesh students protest government job quotas,https://www.aljazeera.com/program/newsfeed/2024/7/16/dozens-wounded-as-bangladesh-students-protest-government-job-quotas,2024-07-16T11:09:41Z
Dozens wounded as students protest government job quotas in Bangladesh,https://www.aljazeera.com/news/2024/7/15/dozens-wounded-as-students-protest-government-job-quotas-in-bangladesh,2024-07-15T16:09:29Z
‘We sought rights’: Bangladesh on edge after quota protest turns violent,https://www.aljazeera.com/features/2024/7/16/we-sought-rights-bangladesh-on-edge-after-quota-protest-turns-violent,2024-07-16T12:03:37Z
Violent and fatal anti-quota protests rock Bangladesh,https://www.aljazeera.com/program/newsfeed/2024/7/18/violent-and-fatal-anti-quota-protests-rock-bangladesh,2024-07-18T19:41:44Z
"Bangladesh students defy orders, occupy universities as tensions spiral",https://www.aljazeera.com/news/2024/7/17/bangladesh-students-defy-orders-occupy-universities-as-tensions-spiral,2024-07-17T12:50:27Z
"‘It’s war now’: As Bangladesh quota protests escalate, what’s next?",https://www.aljazeera.com/news/2024/7/19/its-war-now-as-bangladesh-quota-protests-escalate-whats-next,2024-07-19T11:23:30Z
What’s behind Bangladesh’s violent quota protests?,https://www.aljazeera.com/news/2024/7/16/whats-behind-bangladeshs-violent-quota-protests,2024-07-16T14:00:51Z
[Removed],https://removed.com,1970-01-01T00:00:00Z
Telecoms cut in Bangladesh as deadly protests over government jobs escalate,https://www.cbc.ca/news/world/bangladesh-jobs-protests-telecoms-cut-1.7268940,2024-07-19T13:57:40Z
"As Protests Erupt, a Rocky Start to Sheikh Hasina’s Fourth Consecutive Term",https://thediplomat.com/2024/07/as-protests-erupt-a-rocky-start-to-sheikh-hasinas-fourth-consecutive-term/,2024-07-18T13:17:50Z
[Removed],https://removed.com,1970-01-01T00:00:00Z
At least 5 killed as Bangladesh students clash with police in protest over job quotas,https://www.cbc.ca/news/world/bangladesh-deadly-protests-jobs-1.7264877,2024-07-16T16:06:06Z
Bangladesh protest death toll reaches 32,https://www.bangkokpost.com/world/2831693/bangladesh-protest-death-toll-reaches-32,2024-07-18T15:17:00Z
Student protesters vow ‘complete shutdown’ in Bangladesh after days of violent protest,https://www.bostonglobe.com/2024/07/18/world/student-protesters-vow-complete-shutdown-bangladesh-after-days-violent-protest/,2024-07-18T07:55:21Z
[Removed],https://removed.com,1970-01-01T00:00:00Z
Bangladesh suspends internet after 28 killed in deadly protests,https://www.nbcnews.com/news/world/bangladesh-suspends-internet-28-killed-deadly-protests-government-jobs-rcna162665,2024-07-19T09:18:01Z
Bangladesh Students Reject PM Olive Branch After Deadly Protests,https://www.ibtimes.com/bangladesh-students-reject-pm-olive-branch-after-deadly-protests-3737269,2024-07-18T06:57:10Z
"Bangladesh closes universities, colleges indefinitely after deadly protests over job quotas",https://www.cbc.ca/news/world/bangladesh-deadly-protests-jobs-government-investigating-1.7266326,2024-07-17T16:48:48Z
Violence breaks out at Bangladesh anti-quota protests,https://japantoday.com/category/world/violence-breaks-out-at-bangladesh-anti-quota-protests-government-orders-probe-into-killings,2024-07-17T21:32:42Z
Why are Bangladesh students protesting government job quotas?,https://www.voanews.com/a/why-are-bangladesh-students-protesting-government-job-quotas-/7703253.html,2024-07-18T14:19:57Z
Bangladesh Riots Force Government To Cut Internet Nationwide As Chaos Erupts,https://www.activistpost.com/2024/07/bangladesh-riots-force-government-to-cut-internet-nationwide-as-chaos-erupts.html,2024-07-18T22:22:59Z
Violent clashes erupt between police and protesters in Dhaka even after 6 die during campus protests,https://www.bostonglobe.com/2024/07/17/world/violent-clashes-erupt-between-police-protesters-dhaka-even-after-6-die-during-campus-protests/,2024-07-17T21:52:11Z
Student protesters vow 'complete shutdown' in Bangladesh after days of violent protest,https://www.startribune.com/student-protesters-vow-complete-shutdown-in-bangladesh-after-days-of-violent-protest/600381562/,2024-07-18T07:48:01Z
Bangladeshi protesters demand end to civil service job quotas,https://www.voanews.com/a/bangladeshi-protesters-demand-end-to-civil-service-job-quotas/7688573.html,2024-07-07T23:41:48Z
Here's what to know about the violent protests over government jobs roiling Bangladesh,https://www.startribune.com/heres-what-to-know-about-the-violent-protests-over-government-jobs-roiling-bangladesh/600381570/,2024-07-18T09:47:01Z
At least 16 killed as students clash with police in Bangladesh,https://news.sky.com/story/at-least-16-killed-as-students-clash-with-police-in-bangladesh-over-jobs-reserved-for-veterans-families-13180383,2024-07-18T13:11:00Z
Young men trapped between war and conscription in Myanmar’s Rakhine,https://www.aljazeera.com/news/2024/6/20/young-men-trapped-between-war-and-conscription-in-myanmars-rakhine,2024-06-20T23:13:01Z
Student protesters vow 'complete shutdown' in Bangladesh after days of violent protest,https://abcnews.go.com/International/wireStory/student-protesters-vow-complete-shutdown-bangladesh-after-days-112055767,2024-07-18T08:06:26Z
"Bangladesh TV news off air, communications disrupted as student protests spike",https://www.bangkokpost.com/world/2832178/bangladesh-tv-news-off-air-communications-disrupted-as-student-protests-spike,2024-07-19T06:14:00Z
"Half The Globe Is Voting In 2024 - 80% Want Climate Action, New UN Study",https://www.forbes.com/sites/joanmichelson2/2024/06/30/half-the-globe-is-voting-in-202480-want-climate-action-new-un-study/,2024-06-30T22:42:22Z
Here's what to know about the violent protests over government jobs roiling Bangladesh,https://abcnews.go.com/International/wireStory/violent-protests-government-jobs-roiling-bangladesh-112056600,2024-07-18T10:06:25Z
Anger over jobs reserved for war heroes' children,https://www.bbc.com/news/articles/cpv3kn5v565o,2024-07-11T06:20:52Z
Bangladesh Riots Force Government To Cut Internet Nationwide As Chaos Erupts,https://biztoc.com/x/13e0b7d8d1806d03,2024-07-18T17:54:04Z
"Police, students clash in Bangladesh as protests over job quotas kill 4 more people",https://timesofindia.indiatimes.com/world/south-asia/police-students-clash-in-bangladesh-as-protests-over-job-quotas-kill-4-more-people/articleshow/111835517.cms,2024-07-18T10:29:53Z
Bangladesh students reject PM olive branch after deadly protests,https://www.digitaljournal.com/world/bangladesh-students-reject-pm-olive-branch-after-deadly-protests/article,2024-07-18T04:58:00Z
100 Injured As Bangladesh Students Clash In Job Quota Protests,https://www.ndtv.com/world-news/100-injured-as-bangladesh-students-clash-in-job-quota-protests-6113377,2024-07-15T17:59:35Z
Bangladesh suspends job quotas after student protests,https://economictimes.indiatimes.com/news/international/world-news/bangladesh-suspends-job-quotas-after-student-protests/articleshow/111630364.cms,2024-07-10T08:56:54Z
Huge IT outage affects global businesses,https://www.marketplace.org/shows/marketplace-morning-report/huge-it-outage-affects-global-businesses/,2024-07-19T10:58:53Z
AASU protests intensify against CAA 2019 implementation,https://thehillstimes.in/assam/aasu-protests-intensify-against-caa-2019-implementation,2024-07-17T00:35:08Z
Bangladesh government says ready to hold talks with quota protesters; Army deployed nationwide,https://economictimes.indiatimes.com/news/international/world-news/bangladesh-government-says-ready-to-hold-talks-with-quota-protesters-army-deployed-nationwide/articleshow/111835685.cms,2024-07-18T10:28:47Z
Bangladesh govt says ready to hold talks with quota protesters; Army deployed nationwide,https://thehillstimes.in/international/bangladesh-govt-says-ready-to-hold-talks-with-quota-protesters-army-deployed-nationwide,2024-07-18T18:45:16Z
Rescinding Dr. Segal: Mt. Irony in the Age of Resurrected US McCarthyism,https://www.counterpunch.org/2024/06/24/rescinding-dr-segal-mt-irony-in-the-age-of-resurrected-us-mccarthyism/,2024-06-24T05:51:59Z
Bangladeshi community in St. John's fears for loved ones amid protests in south Asian country,https://www.cbc.ca/news/canada/newfoundland-labrador/bangladesh-students-protests-nl-concern-1.7268104,2024-07-19T12:05:07Z
Too late for talks: Bangladesh students demand action; death toll hits 25,https://www.business-standard.com/world-news/too-late-for-talks-bangladesh-students-demand-action-death-toll-hits-25-124071900302_1.html,2024-07-19T05:43:38Z
"AASU hits streets against CAA, govt FT directive",https://thehillstimes.in/assam/aasu-hits-streets-against-caa-govt-ft-directive,2024-07-16T23:05:31Z
Bangladesh PM vows justice for 6 killed in student protests,https://www.dw.com/en/bangladesh-pm-vows-justice-for-6-killed-in-student-protests/a-69684473,2024-07-16T21:54:00Z
[Removed],https://removed.com,1970-01-01T00:00:00Z
"Bangladesh student protest: Rally, deaths, nationwide shutdowns, and more",https://www.business-standard.com/world-news/bangladesh-student-protest-explained-rally-deaths-nationwide-shutdowns-and-more-124071800624_1.html,2024-07-18T09:36:22Z
[Removed],https://removed.com,1970-01-01T00:00:00Z
Why are Bangladesh students protesting against job quotas?,https://economictimes.indiatimes.com/news/international/world-news/why-are-bangladesh-students-protesting-against-job-quotas/articleshow/111831842.cms,2024-07-18T08:30:27Z
Bangladesh security forces fire bullets and sound grenades as protests over government jobs escalate,https://economictimes.indiatimes.com/news/defence/bangladesh-security-forces-fire-bullets-and-sound-grenades-as-protests-over-government-jobs-escalate/articleshow/111860489.cms,2024-07-19T10:04:28Z
Malaysian High Commission in Dhaka assures safety of Malaysians amid student protest,https://www.thestar.com.my/news/nation/2024/07/18/malaysian-high-commission-in-dhaka-assures-safety-of-malaysians-amid-student-protest,2024-07-18T14:52:00Z
South Africa’s Anti-Apartheid Struggle Holds Lessons for Today’s Anti-Zionists,https://tempestmag.org/2024/06/south-africas-case-against-israel/,2024-06-30T18:33:42Z
Controversy erupts in Assam over instruction to police to not forward CAA cases to Foreigners Tribunals,https://economictimes.indiatimes.com/news/politics-and-nation/controversy-erupts-in-assam-over-instruction-to-police-to-not-forward-caa-cases-to-foreigners-tribunals/articleshow/111787253.cms,2024-07-16T13:28:26Z
"32 dead in Bangladesh unrest, protesters set fire to state TV network",https://economictimes.indiatimes.com/news/international/world-news/32-dead-in-bangladesh-unrest-protesters-set-fire-to-state-tv-network/articleshow/111841550.cms,2024-07-18T14:12:06Z
'Oppn always has to be ready for elections in Parliamentary democracy': Chidambaram amidst Lalu's prediction of NDA fall,https://economictimes.indiatimes.com/news/politics-and-nation/oppn-always-has-to-be-ready-for-elections-in-parliamentary-democracy-chidambaram-amidst-lalus-prediction-of-nda-fall/articleshow/111728685.cms,2024-07-14T08:36:08Z
"News24 | Bangladesh protesters set state TV HQ on fire, internet cut",https://www.news24.com/news24/world/news/bangladesh-protesters-set-state-tv-hq-on-fire-internet-cut-20240718,2024-07-18T18:52:44Z
Bangladesh Students Reject PM Olive Branch After Deadly Protests,https://www.ibtimes.com.au/bangladesh-students-reject-pm-olive-branch-after-deadly-protests-1849674,2024-07-18T09:30:10Z
Bangladesh protests: Students set state broadcaster alight,https://www.bbc.co.uk/news/articles/ck5g9xd9rrwo,2024-07-18T14:53:08Z
"Police, students clash in Bangladesh as protests over job quotas kill 4 more people - Reuters",https://slashdot.org/firehose.pl?op=view&amp;id=174529877,2024-07-18T12:12:50Z
19 more die in Bangladesh clashes as student protesters try to impose a 'complete shutdown' - The Associated Press,https://slashdot.org/firehose.pl?op=view&amp;id=174538855,2024-07-19T10:33:50Z
Why Is the Bangladesh Government Unable to Quell Ongoing Students Protests?,https://thediplomat.com/2024/07/why-is-the-bangladesh-government-unable-to-quell-ongoing-students-protests/,2024-07-15T14:06:00Z
Bangladesh: Students protest jobs reserved for war heroes' children,https://www.bbc.co.uk/news/articles/cpv3kn5v565o,2024-07-11T06:20:52Z
"Bangladesh students clash in job quota protests, at least 100 injured",https://www.thestar.com.my/news/world/2024/07/16/bangladesh-students-clash-in-job-quota-protests-at-least-100-injured,2024-07-15T17:57:00Z
Bangladeshi University Students Protest Quota System Reforms,https://thediplomat.com/2024/07/bangladeshi-university-students-protest-quota-system-reforms/,2024-07-10T13:41:00Z
Bangladesh protests: Anger over job quotas escalates into deadly violence. Here’s what you need to know,https://www.cnn.com/2024/07/19/asia/bangladesh-job-quota-protests-explainer-intl-hnk/index.html,2024-07-19T05:22:28Z
Bangladesh quota protesters call for nationwide shutdown amid clashes,https://www.thestar.com.my/news/world/2024/07/18/bangladesh-quota-protesters-call-for-nationwide-shutdown-amid-clashes,2024-07-18T05:11:00Z
Deadly unrest over job quotas grips Bangladesh,https://www.bbc.co.uk/news/articles/cd1rzm4kjx0o,2024-07-17T08:45:25Z
Summer 2024 recommended reading from MIT,https://news.mit.edu/2024/summer-reading-from-mit-0703,2024-07-03T04:00:00Z
Bangladesh protests: Death toll rises as communications face widespread disruption,https://www.irishtimes.com/world/asia-pacific/2024/07/19/bangladesh-protests-death-toll-rises-as-communications-face-widespread-disruption/,2024-07-19T06:37:47Z
Bangladesh job quota protesters call for nationwide shutdown,https://www.aljazeera.com/gallery/2024/7/18/bangladesh-job-quota-protesters-call-for-nationwide-shutdown,2024-07-18T06:39:54Z
Bangladesh Internet in ‘Total Shutdown’ Amid Student Protests and Dozens of Deaths: ‘Things Are Really Turning Bad’,https://variety.com/2024/politics/news/bangladesh-internet-shutdown-student-protests-deaths-1236078025/,2024-07-19T08:48:37Z
Daily Press Briefing by the Office of the Spokesperson for the Secretary-General,https://press.un.org/en/2024/db240716.doc.htm,2024-07-16T21:04:51Z
19 more die in Bangladesh clashes as student protesters try to impose ‘complete shutdown’,https://english.khabarhub.com/2024/19/366120/,2024-07-19T02:48:36Z
Why are Bangladesh students protesting government job quotas?,https://english.khabarhub.com/2024/19/366126/,2024-07-19T03:38:43Z
