title,url,publishedAt
The Best Invisible Hearing Aids to Keep Your Hearing Loss Private (2024),https://www.wired.com/gallery/best-invisible-hearing-aids/,2024-07-16T14:00:00Z
I’m finding the joy in writing again with a little help from the Supernote Nomad,https://consent.yahoo.com/v2/collectConsent?sessionId=1_cc-session_bdfcec8d-d1bc-489f-83da-fe985305e0f9,2024-07-04T13:00:48Z
The Best Hearing Aids for Seniors (2024),https://www.wired.com/gallery/best-hearing-aids-for-seniors/,2024-07-13T14:00:00Z
The Real Reason Will Smith Broke Twitch’s Biggest Streaming Record,https://www.wired.com/story/will-smith-twitch-streaming-record/,2024-07-15T22:29:21Z
RWBY Will RTRN With Some Help From Viz Media,https://gizmodo.com/rwby-anime-viz-media-revival-rooster-teeth-2000377196,2024-07-06T18:50:25Z
'People in severe mental crisis need help',https://www.bbc.com/news/articles/ck5g4y70k8wo,2024-07-09T17:10:29Z
"The Morning After: US officials help take down AI-powered Russian bot farm with nearly 1,000 fake X accounts",https://consent.yahoo.com/v2/collectConsent?sessionId=1_cc-session_d1542bb9-0b55-4f68-86f6-e53368593b00,2024-07-10T11:16:59Z
Inside the AI memory machine,https://www.theverge.com/2024/7/14/24197107/ai-memory-recall-limitless-gemini-vergecast,2024-07-14T14:00:00Z
Could maths help in taking the perfect penalty?,https://www.bbc.com/news/articles/cjm9ep377mxo,2024-07-10T00:42:58Z
"Your Voice, Your Vote: More help needed for mental health",https://www.bbc.com/news/articles/c9000727wevo,2024-06-25T10:46:34Z
"Stop snap elections to help diversity, says ex MS",https://www.bbc.com/news/articles/cevvrqv7y24o,2024-06-23T06:22:47Z
Race Across the World winner to help people face loss,https://www.bbc.com/news/articles/cv2g5n800mxo,2024-07-02T05:22:35Z
Greece starts six-day working week for some industries,https://www.bbc.com/news/articles/czd9g7yzn4jo,2024-07-03T10:36:20Z
Dune-Inspired Spacesuit Recycles Urine Into Clean Drinking Water,https://gizmodo.com/dune-inspired-spacesuit-recycles-urine-into-clean-drinking-water-2000469804,2024-07-12T15:35:48Z
We Can Now See How Psilocybin Changes the Brain,https://gizmodo.com/we-can-now-see-how-psilocybin-changes-the-brain-2000474284,2024-07-17T15:00:07Z
Ozempic and Other GLP-1 Drugs May Cut Cancer Risk,https://gizmodo.com/ozempic-and-other-glp-1-drugs-may-cut-cancer-risk-2000376895,2024-07-05T15:31:20Z
Doctor Who and Star Trek are Bringing Friendship to San Diego Comic-Con,https://gizmodo.com/doctor-who-star-trek-sdcc-panel-friendship-universal-2000470683,2024-07-13T18:50:39Z
The Best Free Apps for Monitoring PC Gaming Performance,https://gizmodo.com/the-best-free-apps-for-monitoring-pc-gaming-performance-2000469769,2024-07-13T10:00:53Z
6 Tips to Make You a Better Reddit User,https://gizmodo.com/6-tips-to-make-you-a-better-reddit-user-2000470063,2024-07-15T10:00:09Z
UK's only free-roaming bison herd thriving in Kent,https://www.bbc.com/news/articles/c6p250dw299o,2024-07-18T05:10:02Z
Google rolls out Gemini side panels for Gmail and other Workspace apps,https://consent.yahoo.com/v2/collectConsent?sessionId=1_cc-session_7f82fff4-abe2-4730-a938-ff33666d280e,2024-06-25T12:30:38Z
Volunteers to begin huge search for Jay Slater,https://www.bbc.com/news/articles/c147lldzwvro,2024-06-29T04:52:19Z
"Today's Wordle Hints, Answer and Help for July 18, #1125",https://www.cnet.com/tech/gaming/todays-wordle-hints-answer-and-help-for-july-18-1125/,2024-07-18T03:00:13Z
"Today's Wordle Hints, Answer and Help for July 6, #1113",https://www.cnet.com/tech/gaming/todays-wordle-hints-answer-and-help-for-july-6-1113/,2024-07-06T03:00:03Z
Google Plans to Give Dark Web Monitoring to Everyone,https://gizmodo.com/google-plans-to-give-dark-web-monitoring-to-everyone-2000378154,2024-07-09T14:30:52Z
Google spotted developing 'Adaptive Thermal' to help Pixels stay cool,https://www.androidcentral.com/phones/google-pixel-adaptive-thermal-code-spotted,2024-06-21T19:36:21Z
"Today's Wordle Hints, Answer and Help for June 28, #1105",https://www.cnet.com/tech/gaming/todays-wordle-hints-answer-and-help-for-june-28-1105/,2024-06-28T03:00:07Z
"Today's Wordle Hints, Answer and Help for July 1, #1108",https://www.cnet.com/tech/gaming/todays-wordle-hints-answer-and-help-for-july-1-1108/,2024-07-01T03:00:08Z
"Today's Wordle Hints, Answer and Help for July 2, #1109",https://www.cnet.com/tech/gaming/todays-wordle-hints-answer-and-help-for-july-2-1109/,2024-07-02T03:00:09Z
White House Planning Conference for Social Media Influencers Ahead of TikTok Ban,https://gizmodo.com/joe-biden-creators-debate-white-house-conference-social-1851567061,2024-06-28T19:20:00Z
Interview With the Vampire's Grand Trial Is Full of Bite,https://gizmodo.com/interview-with-vampire-season-2-ep-7-claudia-lestat-1851557701,2024-06-24T21:20:00Z
Can history help us understand political violence against elected officials?,https://www.npr.org/2024/07/14/nx-s1-5036898/can-history-help-us-understand-political-violence-against-elected-officials,2024-07-14T20:37:39Z
How to help prevent more political violence this election cycle,https://www.npr.org/2024/07/18/nx-s1-5040533/how-to-help-prevent-more-political-violence-this-election-cycle,2024-07-18T20:42:58Z
"Multivitamin Supplements Don't Help You Live Longer, Major Study Shows",https://science.slashdot.org/story/24/06/27/230257/multivitamin-supplements-dont-help-you-live-longer-major-study-shows,2024-06-28T07:00:00Z
This board game may help communities prepare for wildfire catastrophes,https://www.npr.org/2024/06/20/nx-s1-5004987-e1/this-board-game-may-help-communities-prepare-for-wildfire-catastrophes,2024-06-20T21:28:27Z
Biden needs the TikTok generation. His awful debate won't help.,https://www.businessinsider.com/biden-trump-debate-social-media-tiktok-reaction-study-2024-7,2024-07-01T18:50:13Z
AI could become a lawyer's greatest help in the courtroom,https://www.businessinsider.com/artificial-intelligence-use-in-law-firms-legal-cases-2024-6,2024-06-20T14:02:57Z
"VW puts $5B into cash-hungry Rivian, and Rivian will help fix up VW’s software",https://arstechnica.com/cars/2024/06/vw-invests-5b-into-rivian-signaling-deep-tech-ties-and-collaborations/,2024-06-26T16:07:44Z
[Removed],https://removed.com,1970-01-01T00:00:00Z
"5 Summer Travel Tips to Save Money, From a Professional Digital Nomad",https://www.cnet.com/personal-finance/5-summer-travel-tips-to-save-money-from-a-professional-digital-nomad/,2024-07-11T21:46:01Z
Our Top Recommended Robot Vacuum of 2024 is On Sale This Prime Day,https://www.cnet.com/deals/our-top-recommended-robot-vacuum-of-2024-is-on-sale/,2024-07-15T15:35:00Z
Hurricanes Are Trapping Small Island Nations in Ever-Worsening Spirals of Debt,https://www.wired.com/story/hurricanes-are-trapping-small-island-nations-in-ever-worsening-spirals-of-debt/,2024-07-13T13:00:00Z
How to Make Google Maps Work for You While Traveling This Summer,https://www.cnet.com/tech/services-and-software/how-to-make-google-maps-work-for-you-while-traveling-this-summer/,2024-06-29T21:00:08Z
iOS 18 Includes Two New Background Sounds to Help You Focus or Rest,https://www.macrumors.com/2024/07/10/ios-18-new-background-sounds/,2024-07-10T14:42:35Z
Oura brings a personalized coach to help you reach your health goals,https://www.androidcentral.com/wearables/oura-app-advisor-labs-test-launch,2024-07-09T13:00:00Z
Low-Income Internet Guide: These Affordable Plans Can Help Fill the ACP Gap,https://www.cnet.com/home/internet/low-income-internet-guide-these-affordable-plans-can-help-fill-the-acp-gap/,2024-07-13T19:00:00Z
"Today's NYT Strands Hints, Answers and Help for July 10, #129",https://www.cnet.com/tech/gaming/todays-nyt-strands-hints-answers-and-help-for-july-10-129/,2024-07-10T03:00:03Z
"Today's NYT Connections Hints, Answers and Help for July 10, #395",https://www.cnet.com/tech/gaming/todays-nyt-connections-hints-answers-and-help-for-july-10-395/,2024-07-10T03:00:06Z
"Today's NYT Connections Hints, Answers and Help for July 14, #399",https://www.cnet.com/tech/gaming/todays-nyt-connections-hints-answers-and-help-for-july-14-399/,2024-07-14T03:00:06Z
"Today's NYT Strands Hints, Answers and Help for July 18, #137",https://www.cnet.com/tech/gaming/todays-nyt-strands-hints-answers-and-help-for-july-18-137/,2024-07-18T03:00:04Z
"Today's NYT Strands Hints, Answers and Help for July 19, #138",https://www.cnet.com/tech/gaming/todays-nyt-strands-hints-answers-and-help-for-july-19-138/,2024-07-19T03:00:10Z
"Today's NYT Strands Hints, Answers and Help for July 6, #125",https://www.cnet.com/tech/gaming/todays-nyt-strands-hints-answers-and-help-for-july-6-125/,2024-07-06T03:00:09Z
"Today's NYT Connections Hints, Answers and Help for July 6, #391",https://www.cnet.com/tech/gaming/todays-nyt-connections-hints-answers-and-help-for-july-6-391/,2024-07-06T03:00:06Z
"Today's NYT Connections Hints, Answers and Help for July 18, #403",https://www.cnet.com/tech/gaming/todays-nyt-connections-hints-answers-and-help-for-july-18-403/,2024-07-18T03:00:10Z
Today's NYT Mini Crossword Answers and Puzzle Help for July 18,https://www.cnet.com/tech/gaming/todays-nyt-mini-crossword-answers-and-puzzle-help-for-july-18/,2024-07-18T03:00:21Z
Today's NYT Mini Crossword Answers and Puzzle Help for July 17,https://www.cnet.com/tech/gaming/todays-nyt-mini-crossword-answers-and-puzzle-help-for-july-17/,2024-07-17T05:43:49Z
"Today's NYT Connections Hints, Answers and Help for July 19, #404",https://www.cnet.com/tech/gaming/todays-nyt-connections-hints-answers-and-help-for-july-19-404/,2024-07-19T03:00:08Z
How to Freeze Your Credit -- and Why You Might Want To - CNET,https://www.cnet.com/personal-finance/credit-cards/advice/how-to-freeze-your-credit-and-why-you-might-want-to/,2024-06-24T14:37:00Z
3 Anti-Aging Exercises That Will Help Boost and Maintain Your Health,https://www.cnet.com/health/fitness/anti-aging-exercises/,2024-06-29T18:00:13Z
These 7 Houseplants Can Help Cool Your Home During a Heatwave - CNET,https://www.cnet.com/home/these-7-houseplants-can-help-cool-your-home-during-a-heatwave/,2024-06-22T12:50:00Z
"Today's Wordle Hints, Answer and Help for June 25, #1102 - CNET",https://www.cnet.com/tech/services-and-software/todays-wordle-hints-answer-and-help-for-june-25-1102/,2024-06-25T00:00:03Z
"Today's NYT Connections Hints, Answers and Help for July 1, #386",https://www.cnet.com/tech/gaming/todays-nyt-connections-hints-answers-and-help-for-july-1-386/,2024-07-01T03:00:06Z
"Today's NYT Strands Hints, Answers and Help for July 2, #121",https://www.cnet.com/tech/gaming/todays-nyt-strands-hints-answers-and-help-for-july-2-121/,2024-07-02T03:00:03Z
"Today's NYT Connections Hints, Answers and Help for July 2, #387",https://www.cnet.com/tech/gaming/todays-nyt-connections-hints-answers-and-help-for-july-2-387/,2024-07-02T03:00:07Z
"Today's NYT Connections Hints, Answers and Help for June 28, #383",https://www.cnet.com/tech/gaming/todays-nyt-connections-hints-answers-and-help-for-june-28-383/,2024-06-28T03:00:09Z
"Today's NYT Strands Hints, Answers and Help for June 28, #117",https://www.cnet.com/tech/gaming/todays-nyt-strands-hints-answers-and-help-for-june-28-117/,2024-06-28T03:00:03Z
"Today's NYT Strands Hints, Answers and Help for July 1, #120",https://www.cnet.com/tech/gaming/todays-nyt-strands-hints-answers-and-help-for-july-1-120/,2024-07-01T03:00:03Z
Lasers Could Help Us Recycle Plastics Into Carbon Dots,https://hackaday.com/2024/07/18/lasers-could-help-us-recycle-plastics-into-carbon-dots/,2024-07-18T11:00:50Z
How Improv Comedy Can Help Resolve Conflicts,https://time.com/6991701/improv-comedy-conflict-resolution-essay/,2024-06-26T11:00:00Z
"As heat waves intensify, more public housing residents may get help with AC bills",https://www.npr.org/2024/07/04/nx-s1-5029544/hud-heat-waves-public-housing-residents-ac-bills,2024-07-04T20:00:54Z
"When Molly’s husband died, a friend came up with a way to help: The ‘Calendar Girls’",https://www.npr.org/2024/07/10/nx-s1-5032692/unsung-hero-grief-acts-of-kindness,2024-07-10T19:45:00Z
Many 2022 wildfire victims in New Mexico say they've not gotten enough help from FEMA,https://www.npr.org/2024/07/17/nx-s1-5021784/many-2022-wildfire-victims-in-new-mexico-say-theyve-not-gotten-enough-help-from-fema,2024-07-17T08:37:11Z
What color Samsung Galaxy Watch Ultra should you buy?,https://www.androidcentral.com/wearables/samsung-galaxy-watch/what-color-samsung-galaxy-watch-ultra-should-you-buy,2024-07-10T14:00:45Z
A bridge for wildlife could help get grizzlies off the endangered list,https://www.npr.org/2024/07/04/nx-s1-4974933/a-bridge-for-wildlife-could-help-get-grizzlies-off-the-endangered-list,2024-07-04T21:03:44Z
Howard students help a rapper request a new trial after lyrics were used as evidence,https://www.npr.org/2024/07/12/nx-s1-5035276/howard-students-help-a-rapper-request-a-new-trial-after-lyrics-were-used-as-evidence,2024-07-12T22:14:04Z
I'm 31 and my parents pay my mortgage — their help is a lifeline,https://www.businessinsider.com/parents-help-pay-mortgage-leaving-full-time-job-2024-7,2024-07-17T12:38:03Z
Don’t Use Credit Cards to Pay Your Energy Bills. Do This Instead,https://www.cnet.com/personal-finance/credit-cards/advice/dont-use-credit-cards-to-pay-your-energy-bills-do-this-instead/,2024-07-17T12:01:00Z
Samsung Galaxy Watch Ultra vs. Google Pixel Watch 2,https://www.androidcentral.com/wearables/samsung-galaxy-watch-ultra-vs-google-pixel-watch-2,2024-07-10T15:30:05Z
4 ways OpenAI's newest AI model GPT-4o can make you more productive at work,https://www.businessinsider.com/chatgpt-gpt-4o-productivity-hacks-for-work-2024-7,2024-07-15T14:54:11Z
Starbucks could give a much-needed jolt to the EV market,https://www.businessinsider.com/starbucks-ev-charging-stations-mercedes-benz-2024-7,2024-07-18T14:36:08Z
"Yes, You Can Support Small Businesses on Amazon Prime Day. Here's How",https://www.cnet.com/personal-finance/banking/advice/shop-small-this-prime-day-how-to-spot-small-business-deals-on-amazon/,2024-07-15T15:48:00Z
Get 37% Off a Fire TV 4K and Xbox Controller Bundle Before It's Too Late,https://www.cnet.com/deals/get-37-off-this-fire-tv-4k-max-and-xbox-controller-bundle/,2024-07-18T21:54:00Z
These are the top skills you need to help land a job in AI,https://www.businessinsider.com/ai-top-skills-you-need-get-job-2024-7,2024-07-05T12:30:36Z
Elon Musk has reportedly offered his sperm to help colonize Mars. It's unclear if that's possible.,https://www.businessinsider.com/elon-musk-reportedly-offered-sperm-colonize-mars-maybe-impossible-2024-7,2024-07-11T21:02:02Z
"A 5-day vacation in Bali 13 years ago changed his entire career plan. Now, he's married with 2 kids and calls the island home.",https://www.businessinsider.com/millennial-moved-bali-start-family-kids-home-slow-life-indonesia-2024-7,2024-07-08T01:42:47Z
Locked out,https://www.businessinsider.com/illegal-wrongful-evictions-law-enforcement-police-court-2024-7,2024-07-10T10:19:16Z
The Meater Plus Will Save Your Meat From Well Done Hell,https://www.cnet.com/deals/the-meater-plus-will-save-your-meat-from-well-done-hell/,2024-07-18T15:03:00Z
Motorola Edge 2024 vs. Samsung Galaxy S23 FE: Mid-range showdown,https://www.androidcentral.com/phones/motorola-edge-2024-vs-samsung-galaxy-s23-fe,2024-06-24T15:00:46Z
What color Motorola Razr Plus 2024 should you buy?,https://www.androidcentral.com/phones/what-color-motorola-razr-plus-2024-should-you-buy,2024-06-26T14:38:35Z
Motorola Razr 2024 vs. Razr 2023: Is the new phone better?,https://www.androidcentral.com/phones/motorola-razr-2024-vs-razr-2023,2024-06-30T09:00:27Z
"Kettlebells can help you gain muscle and cardio fitness at the same time. Here's what to know, according to a world-record athlete.",https://www.businessinsider.com/how-to-use-kettlebells-build-muscle-boost-cardio-athlete-tips-2024-7,2024-07-13T10:18:02Z
A watchdog group targets payday lenders with a ‘2 strikes’ rule to help borrowers,https://www.npr.org/2024/06/28/g-s1-246/payday-loans-cash-cfpb,2024-06-28T09:00:00Z
The South is adapting to help keep kids safe as summer heat intensifies,https://www.npr.org/2024/06/21/nx-s1-5015094/the-south-is-adapting-to-help-keep-kids-safe-as-summer-heat-intensifies,2024-06-21T20:48:50Z
"Record temperatures, driven by climate change, help to fuel Hurricane Beryl",https://www.npr.org/2024/07/02/nx-s1-5025129/record-temperatures-driven-by-climate-change-help-to-fuel-hurricane-beryl,2024-07-02T07:26:59Z
When Is the Next Steam Sale? List of Upcoming Steam Sale Dates - CNET,https://www.cnet.com/tech/services-and-software/when-are-steam-sales/,2024-06-22T12:30:00Z
Make Your Phone Last Longer With These Easy Tips,https://www.cnet.com/tech/mobile/make-your-phone-last-longer-with-these-easy-tips/,2024-06-28T12:00:07Z
"Motorola Razr and Razr+ (2024): Specs, Features, Price, Release Date",https://www.wired.com/story/motorola-razr-and-razr-plus-2024/,2024-06-25T16:00:00Z
Florida Police Break Car Window to Help 'Distressed' Dog,https://uk.news.yahoo.com/florida-police-break-car-window-020255203.html,2024-07-10T02:02:55Z
"Trump disavows Project 2025. What is it? And, how to beat shrinkflation",https://www.npr.org/2024/07/11/g-s1-9393/up-first-newsletter-trump-project-2025-shrinkflation,2024-07-11T12:03:37Z
New AI tools for Google Workspace for Education,https://blog.google/outreach-initiatives/education/workspace-gemini-classroom-iste-2024/,2024-06-24T13:05:08Z
