title,url,publishedAt
Maxxxine Star Mia Goth Being Sued For Allegedly Kicking An Extra On Set,https://www.gamespot.com/articles/maxxxine-star-mia-goth-being-sued-for-allegedly-kicking-an-extra-on-set/1100-6524881/,2024-07-11T18:24:00Z
Extra shares more details about alleged Mia Goth battery incident on MaXXXine set,https://www.avclub.com/mia-goth-maxxxine-lawsuit-ti-west-a24-1851586908,2024-07-11T15:11:00Z
Top 5 Mobile Homes Designed For Off-Grid Nomads In 2024,https://www.yankodesign.com/2024/06/21/top-5-mobile-homes-designed-for-off-grid-nomads-in-2024/,2024-06-21T23:30:54Z
Netflix's Exploding Kittens series is lost in translation,https://www.avclub.com/exploding-kittens-review-tv-show-netflix-1851581621,2024-07-11T12:00:00Z
United States Track Star Locked In Porta-Potty One Hour Before Race Qualifies For Olympics With PR,https://brobible.com/sports/article/kendall-ellis-porta-potty-bathroom-locked-400-paris-olympics-track/,2024-06-24T16:57:14Z
"Balenciaga’s €3,500 ‘Raver Used Bracelet’ Costs More Than A Glastonbury Ticket",https://community.designtaxi.com/topic/4147-balenciagas-%E2%82%AC3500-raver-used-bracelet-costs-more-than-a-glastonbury-ticket/,2024-07-13T14:40:25Z
Biden’s demands for the golf match against Trump,https://www.wnd.com/2024/07/bidens-demands-for-the-golf-match-against-trump/,2024-07-18T23:12:43Z
My Strange Arrest S02E02 1080p WEB h264-EDITH,https://rlsbb.cc/my-strange-arrest-s02e02-1080p-web-h264-edith/,2024-07-11T15:07:15Z
Mac Mocks Khabib For Tax Takedown,https://www.mmamania.com/2024/7/1/24189973/pushups-cash-conor-mcgregor-celebrates-reports-tax-authorities-seized-broke-khabib-bank-accounts-ufc,2024-07-01T15:55:38Z
"White Couple Accused of Forcing Adopted Black Children to Work as Slaves, Live in Barn",https://radaronline.com/p/white-couple-accused-of-forcing-adopted-black-children-to-work-as-slaves/,2024-06-25T23:30:00Z
Conor McGregor Mocks Khabib As He Reportedly Flees Russia Amid Financial Seizures,https://brobible.com/sports/article/conor-mcgregor-khabib-nurmagomedov-flees-russia-seizures/,2024-07-03T17:11:59Z
8 dog-friendly beaches in Massachusetts,https://www.bostonglobe.com/2024/07/05/opinion/dog-friendly-beaches-in-massachusetts/,2024-07-05T19:46:22Z
Cobra Kai Recap: The Outsiders,http://www.vulture.com/article/cobra-kai-recap-season-6-episode-4-underdogs.html,2024-07-18T19:00:06Z
Olympic-bound sprinter trapped in toilet before race unlocks new bathroom fear in fellow runners,https://www.cbc.ca/news/world/kendall-ellis-bathroom-runners-1.7245676,2024-06-25T17:15:15Z
My Strange Arrest S02E02 1080p WEB h264-EDITH,https://rlsbb.ru/my-strange-arrest-s02e02-1080p-web-h264-edith/,2024-07-11T14:57:07Z
"What are the wildest sights, sounds, smells from Grandma's Marathon? Bacon, for one.",https://www.startribune.com/what-are-the-wildest-sights-sounds-smells-from-grandmas-marathon-bacon-for-one/600375081/,2024-06-21T11:30:00Z
"Vandals bomb park porta-potty. Reportedly investigation continues, but police have nothing to go on [Misc]",https://www.fark.com/comments/13311642/Vandals-bomb-park-porta-potty-Reportedly-investigation-continues-but-police-have-nothing-to-go-on,2024-07-05T16:05:06Z
Runner qualifies for second Olympics after nearly missing race because of portable restroom mishap,https://www.nbcnews.com/sports/olympics/runner-qualifies-second-olympics-nearly-missing-race-portable-restroom-rcna159528,2024-06-29T10:45:00Z
"Do you get angry about tipping or post in a Fark tipping thread? You might have ""tip rage"" [Stupid]",https://www.fark.com/comments/13321028/Do-you-get-angry-about-tipping-post-in-a-Fark-tipping-thread-You-might-have-tip-rage,2024-07-13T20:14:39Z
"Wealthy white couple allegedly kept their black adopted children as slaves, locked them in barn: report",https://freerepublic.com/focus/f-news/4246746/posts,2024-06-26T01:47:46Z
"3 people stabbed at park in Natrona Heights, man facing charges",https://www.wpxi.com/news/local/3-people-stabbed-park-natrona-heights-man-facing-charges/NPUWQ2IX6VGO7BSYTW5XDF3DV4/,2024-07-07T22:00:34Z
Mia Goth Allegedly Told ‘MaXXXine’ Extra Suing Her for Battery on Set That ‘Nobody Will Believe You Because You’re Nothing’,https://variety.com/2024/film/news/mia-goth-maxxxine-extra-lawsuit-allegation-1236066629/,2024-07-10T22:47:55Z
The ultimate guide to the best beaches in the Twin Cities and beyond,https://www.startribune.com/the-ultimate-guide-to-the-best-beaches-in-the-twin-cities-and-beyond/600376143/,2024-06-27T20:12:34Z
Nursing Parents Still Have No Place to Pump at Work. Now They’re Suing.,https://msmagazine.com/2024/07/05/breastfeeding-nursing-parents-pump-at-work-lawsuit/,2024-07-05T18:02:31Z
